{
  "races": [
    {
      "slug": "elf",
      "name": "Эльф",
      "data": {
        "speed": 30,
        "darkvision": 60,
        "ability_bonuses": { "dex": 2 },
        "traits": [
          {
            "name": "Тёмное зрение",
            "description": "Видит в темноте на 60 футов, различая только оттенки серого."
          },
          {
            "name": "Обострённые чувства",
            "description": "Владение навыком Восприятие."
          },
          {
            "name": "Транс",
            "description": "Не спит, а медитирует по 4 часа в сутки."
          }
        ],
        "languages": ["общий", "эльфийский"]
      }
    }
  ],
  "classes": [
    {
      "slug": "fighter",
      "name": "Воин",
      "hit_die": 10,
      "primary_ability": "strength",
      "data": {
        "saving_throws": ["strength", "constitution"],
        "armor_proficiencies": ["лёгкие доспехи", "средние доспехи", "тяжёлые доспехи", "щиты"],
        "weapon_proficiencies": ["простое оружие", "воинское оружие"]
      },
      "levels": [
        {
          "level": 1,
          "features": {
            "items": [
              {
                "name": "Боевой стиль",
                "description": "Выбирается один боевой стиль, отражающий специализацию персонажа."
              },
              {
                "name": "Второе дыхание",
                "description": "Бонусным действием восстанавливает 1к10 + уровень воина хитов, один раз за короткий или длинный отдых."
              }
            ]
          },
          "spell_slots": null
        },
        {
          "level": 2,
          "features": {
            "items": [
              {
                "name": "Всплеск действия",
                "description": "Один раз за короткий или длинный отдых можно совершить дополнительное действие в свой ход."
              }
            ]
          },
          "spell_slots": null
        },
        {
          "level": 3,
          "features": {
            "items": [
              {
                "name": "Архетип воина",
                "description": "На этом уровне выбирается архетип воина, определяющий дальнейшую специализацию."
              }
            ]
          },
          "spell_slots": null
        }
      ],
      "subclasses": [
        {
          "slug": "champion",
          "name": "Чемпион",
          "unlock_level": 3,
          "data": {
            "features": [
              {
                "name": "Улучшенная критическая атака",
                "description": "Атаки оружием становятся критическими при выпадении 19 или 20 на к20."
              }
            ]
          }
        }
      ]
    }
  ],
  "spells": [
    {
      "slug": "mage-hand",
      "name": "Волшебная рука",
      "level": 0,
      "school": "conjuration",
      "casting_time": "1 действие",
      "range": "30 футов",
      "components": "В, С",
      "duration": "1 минута",
      "description": "Призрачная рука появляется в точке в пределах дистанции и может перемещать лёгкие предметы, открывать незапертые двери и контейнеры.",
      "classes": ["fighter"]
    },
    {
      "slug": "shield",
      "name": "Щит",
      "level": 1,
      "school": "abjuration",
      "casting_time": "1 реакция",
      "range": "На себя",
      "components": "В, С",
      "duration": "1 раунд",
      "description": "Невидимый барьер даёт +5 к КД до начала следующего хода заклинателя, включая защиту от вызвавшей реакцию атаки.",
      "classes": ["fighter"]
    },
    {
      "slug": "cure-wounds",
      "name": "Лечение ран",
      "level": 1,
      "school": "evocation",
      "casting_time": "1 действие",
      "range": "Касание",
      "components": "В, С",
      "duration": "мгновенная",
      "description": "Существо, которого касается заклинатель, восстанавливает 1к8 + модификатор базовой характеристики хитов.",
      "classes": ["fighter"]
    }
  ],
  "items": [
    {
      "slug": "longsword",
      "name": "Длинный меч",
      "type": "weapon",
      "rarity": "обычный",
      "price_g": 15,
      "weight": "1.5",
      "description": "Универсальное воинское рубящее оружие: 1к8 при одноручном хвате, 1к10 — при двуручном."
    },
    {
      "slug": "chain-mail",
      "name": "Кольчуга",
      "type": "armor",
      "rarity": "обычный",
      "price_g": 75,
      "weight": "27",
      "description": "Тяжёлый доспех, КД 16, требует силу 13 и накладывает помеху на скрытность."
    },
    {
      "slug": "healing-potion",
      "name": "Зелье лечения",
      "type": "potion",
      "rarity": "необычный",
      "price_g": 50,
      "weight": "0.25",
      "description": "При выпивании восстанавливает 2к4 + 2 хита."
    },
    {
      "slug": "scroll-of-fireball",
      "name": "Свиток огненного шара",
      "type": "scroll",
      "rarity": "редкий",
      "price_g": 150,
      "weight": "0",
      "description": "Одноразовое использование заклинания «Огненный шар» (3 круг) без необходимости знать его."
    },
    {
      "slug": "adventurers-pack",
      "name": "Набор искателя приключений",
      "type": "gear",
      "rarity": "обычный",
      "price_g": 12,
      "weight": "9",
      "description": "Рюкзак, спальный мешок, трутница, 10 факелов, дневной рацион на 10 дней и бурдюк с водой."
    }
  ],
  "backgrounds": [
    {
      "slug": "soldier",
      "name": "Солдат",
      "data": {
        "skill_proficiencies": ["атлетика", "запугивание"],
        "tool_proficiencies": ["один игровой набор", "наземный транспорт"],
        "equipment": ["знак различия", "трофей поверженного врага", "набор игральных костей", "обычная одежда", "мешочек с 10 зм"],
        "feature": {
          "name": "Воинское звание",
          "description": "Солдаты, служившие под началом персонажа, узнают его и готовы оказать скромную помощь."
        }
      }
    }
  ]
}
